{
  "kind": "atomlearn.strategy-exposure",
  "schema_version": 1,
  "id": "xps-0123456789abcdef01234567",
  "experiment_id": "exp-example-first-001",
  "profile_id": "default",
  "workspace_ref": "ws-0123456789abcdef01234567",
  "workspace_revision": 3,
  "atom_ref": "atom-0123456789abcdef01234567",
  "episode_ref": "episode-0123456789abcdef01234567",
  "arm": "candidate",
  "assigned_value": "example_first",
  "chosen_value": "example_first",
  "context": "teaching",
  "atom_type": "concept",
  "difficulty_bucket": "introductory",
  "prior_diagnostic_bucket": "unassessed",
  "episode_type": "new_learning",
  "stratum": "teaching|concept|introductory|unassessed|new_learning",
  "policy_fingerprint": "sha256:0123456789abcdef0123456789abcdef0123456789abcdef0123456789abcdef",
  "status": "exposed",
  "created_at": "2026-01-01T00:00:00Z"
}
